{
  "$schema": "https://json-schema.org/draft/2020-12/schema",
  "$id": "https://loop.dev/schemas/preflight/profile.schema.json",
  "title": "Loop Preflight Profile",
  "description": "Declarative preflight profile (YAML or JSON). Profiles are data, not code — the Qt plugin stays engine-agnostic.",
  "type": "object",
  "additionalProperties": false,
  "required": ["name", "checks"],
  "properties": {
    "schema_version": {
      "type": "integer",
      "const": 1,
      "description": "Profile contract version. Bump only with a coordinated engine + plugin release."
    },
    "id": {
      "type": "string",
      "pattern": "^[a-z][a-z0-9-]*$",
      "description": "Stable profile identity. Combined with version for human identification; content digest is authoritative."
    },
    "version": {
      "type": "string",
      "pattern": "^[0-9]+\\.[0-9]+\\.[0-9]+$",
      "description": "Semantic version of this profile's policy content."
    },
    "digest": {
      "type": "string",
      "pattern": "^[0-9a-f]{64}$",
      "description": "SHA-256 of canonical semantic content. Import rejects a mismatch rather than repairing it."
    },
    "authored": {
      "type": "object",
      "additionalProperties": false,
      "properties": {
        "by": { "type": "string" },
        "at": { "type": "string", "format": "date-time" },
        "note": { "type": "string" }
      }
    },
    "derived_from": {
      "type": "object",
      "additionalProperties": false,
      "description": "Provenance chain when a profile is forked from another.",
      "properties": {
        "id": { "type": "string" },
        "version": { "type": "string" },
        "digest": { "type": "string", "pattern": "^[0-9a-f]{64}$" }
      }
    },
    "restrictions": { "$ref": "#/$defs/restrictions" },
    "variables": {
      "type": "object",
      "description": "Declared typed variables. Whole-value ${name} substitution preserves JSON type; there are no expressions or nesting.",
      "additionalProperties": { "$ref": "#/$defs/variable" }
    },
    "name": {
      "type": "string",
      "minLength": 1,
      "description": "Human-readable profile name (also referenced by report.profile)."
    },
    "schema_kind": {
      "type": "string",
      "const": "preflight-profile"
    },
    "description": {
      "type": "string",
      "description": "Optional summary of when to use this profile."
    },
    "pdfx": {
      "$ref": "#/$defs/pdfx",
      "description": "Optional PDF/X conformance policy. Omitting this object preserves legacy preflight behavior."
    },
    "job_types": {
      "type": "array",
      "description": "Loop job categories this profile applies to.",
      "items": {
        "type": "string",
        "minLength": 1
      },
      "uniqueItems": true
    },
    "checks": {
      "type": "array",
      "description": "Ordered list of checks to run. Unknown ids are ignored or reported by the engine (implementation-defined).",
      "minItems": 1,
      "items": { "$ref": "#/$defs/check" }
    },
    "fixups": {
      "type": "array",
      "description": "Optional fixups advertised for this profile. Fixups are opt-in; never auto-applied.",
      "items": { "$ref": "#/$defs/fixup" }
    }
  },
  "$defs": {
    "pdfx": {
      "type": "object",
      "additionalProperties": false,
      "required": ["target"],
      "properties": {
        "target": {
          "type": "string",
          "enum": ["PDF/X-1a:2001", "PDF/X-3:2002", "PDF/X-4"],
          "description": "Audited PDF/X policy target."
        },
        "policyVersion": {
          "oneOf": [
            { "type": "string", "const": "1" },
            { "type": "integer", "const": 1 }
          ],
          "description": "Optional Loop policy revision; defaults to the target's registered revision."
        }
      }
    },
    "severity": {
      "type": "string",
      "enum": ["error", "warning", "info"],
      "description": "Finding severity when the check fails. Defaults to error if omitted."
    },
    "restrictions": {
      "type": "object",
      "additionalProperties": false,
      "description": "Inspection scope. Check-level restrictions can only narrow profile-level restrictions.",
      "properties": {
        "pages": {
          "type": "string",
          "pattern": "^([0-9]+(-[0-9]+)?)(,[0-9]+(-[0-9]+)?)*$",
          "description": "1-based inclusive ranges, e.g. \"1,4-8\"."
        },
        "page_box": { "enum": ["media", "crop", "trim", "bleed", "art"] },
        "regions": { "type": "array", "items": { "$ref": "#/$defs/region" } },
        "layers": {
          "type": "array",
          "items": { "type": "string" },
          "description": "OCG names; content outside these layers is out of scope."
        },
        "object_classes": {
          "type": "array",
          "items": { "enum": ["text", "image", "vector", "annotation", "shading", "form"] }
        }
      }
    },
    "region": {
      "type": "object",
      "additionalProperties": false,
      "required": ["name", "rect_pt"],
      "properties": {
        "name": { "type": "string" },
        "rect_pt": {
          "type": "array",
          "items": { "type": "number" },
          "minItems": 4,
          "maxItems": 4
        },
        "anchor": { "enum": ["media", "crop", "trim", "bleed"], "default": "trim" },
        "mode": { "enum": ["include", "exclude"], "default": "include" }
      }
    },
    "variable": {
      "type": "object",
      "additionalProperties": false,
      "required": ["type"],
      "properties": {
        "type": { "enum": ["string", "number", "integer", "boolean"] },
        "default": true,
        "min": { "type": "number" },
        "max": { "type": "number" },
        "required": { "type": "boolean", "default": false },
        "description": { "type": "string" }
      }
    },
    "check": {
      "type": "object",
      "required": ["id"],
      "properties": {
        "id": {
          "type": "string",
          "minLength": 1,
          "pattern": "^[a-z][a-z0-9-]*$",
          "description": "Stable check identifier (kebab-case)."
        },
        "severity": { "$ref": "#/$defs/severity" },
        "enabled": {
          "type": "boolean",
          "default": true,
          "description": "When false, skip this check without removing it from the profile."
        },
        "min_dpi": {
          "type": "number",
          "exclusiveMinimum": 0,
          "description": "Minimum effective image DPI (image-resolution)."
        },
        "amount_pt": {
          "type": "number",
          "minimum": 0,
          "description": "Bleed or similar length in PDF points (1 pt = 1/72 in). 9 pt ≈ 0.125 in."
        },
        "required": {
          "type": "boolean",
          "description": "Whether the checked feature must be present (e.g. bleed)."
        },
        "allowed": {
          "type": "array",
          "description": "Allow-list for categorical checks (e.g. color-mode or output-intent ICC color spaces).",
          "items": { "type": "string", "minLength": 1 },
          "minItems": 1,
          "uniqueItems": true
        },
        "allowed_identifiers": {
          "type": "array",
          "description": "Optional allow-list of /OutputConditionIdentifier values (output-intent).",
          "items": { "type": "string", "minLength": 1 },
          "minItems": 1,
          "uniqueItems": true
        },
        "allowed_subtypes": {
          "type": "array",
          "description": "Optional allow-list of output-intent /S subtype names.",
          "items": { "type": "string", "minLength": 1 },
          "minItems": 1,
          "uniqueItems": true
        },
        "allowed_profile_sha256": {
          "type": "array",
          "description": "Optional allow-list of SHA-256 digests for decoded ICC payloads.",
          "items": { "type": "string", "pattern": "^[0-9A-Fa-f]{64}$" },
          "minItems": 1,
          "uniqueItems": true
        },
        "require_embedded_profile": {
          "type": "boolean",
          "description": "Whether an output intent must contain a decodable /DestOutputProfile ICC stream.",
          "default": true
        },
        "allow_multiple": {
          "type": "boolean",
          "description": "Whether more than one valid applicable output intent is permitted.",
          "default": true
        },
        "expected_width_pt": {
          "type": "number",
          "exclusiveMinimum": 0,
          "description": "Expected trim/page width in points (page-size / trim)."
        },
        "expected_height_pt": {
          "type": "number",
          "exclusiveMinimum": 0,
          "description": "Expected trim/page height in points (page-size / trim)."
        },
        "tolerance_pt": {
          "type": "number",
          "minimum": 0,
          "description": "Allowed size mismatch in points."
        },
        "raster_confirm": {
          "type": "boolean",
          "default": false,
          "description": "When true, run strip-raster confirmation on pages flagged by the fast bounds pass (content-bleed only)."
        },
        "probe_dpi": {
          "type": "number",
          "exclusiveMinimum": 0,
          "default": 150,
          "description": "DPI for raster probes (content-bleed, ink-coverage, and color-inventory page inspection)."
        },
        "probe_threshold": {
          "type": "number",
          "minimum": 0,
          "default": 16,
          "description": "Pixel channel threshold (0-255) that counts as ink in the raster probe (content-bleed only)."
        },
        "rich_black_k_percent": {
          "type": "number",
          "minimum": 0,
          "maximum": 100,
          "default": 10,
          "description": "Minimum process-black percentage for rich-black inventory (color-inventory only)."
        },
        "max_ink_pct": {
          "type": "number",
          "exclusiveMinimum": 0,
          "description": "Maximum total ink coverage percentage (ink-coverage, e.g. 300 for 300% TAC)."
        },
        "min_region_area_pct": {
          "type": "number",
          "minimum": 0,
          "default": 0.05,
          "deprecated": true,
          "description": "Deprecated and ignored (ink-coverage). A page-relative floor let an isolated over-limit element pass clean; use min_region_area_mm2."
        },
        "min_region_area_mm2": {
          "type": "number",
          "minimum": 0,
          "default": 0.25,
          "description": "Smallest over-limit connected region, in mm^2, that ink-coverage reports. Over-limit regions at or above it that the raster cannot resolve make the check incomplete."
        },
        "max_regions_per_page": {
          "type": "integer",
          "minimum": 0,
          "default": 20,
          "description": "Maximum number of ink-coverage regions reported per page. Zero deliberately suppresses region findings while still inspecting the page."
        },
        "max_raster_pixels": {
          "type": "integer",
          "exclusiveMinimum": 0,
          "default": 250000000,
          "description": "Per-page raster pixel budget for ink-coverage and bounded thin-parts masks. Exceeding it produces an incomplete/skipped check, never a clean pass."
        },
        "analysis_box": {
          "type": "string",
          "enum": ["bleed", "trim", "crop", "media"],
          "default": "bleed",
          "description": "Production region for TAC analysis. Bleed falls back to Trim, Crop, then Media when a box is unavailable."
        },
        "min_effective_width_pt": {
          "type": "number",
          "exclusiveMinimum": 0,
          "description": "Minimum painted stroke or filled-part width in points for thin-strokes and thin-parts."
        },
        "zero_width_epsilon_pt": {
          "type": "number",
          "minimum": 0,
          "default": 0.000001,
          "description": "Declared stroke widths at or below this value are hairlines."
        },
        "hairline_severity": {
          "$ref": "#/$defs/severity",
          "description": "Severity override for hairline-stroke findings."
        },
        "thin_stroke_severity": {
          "$ref": "#/$defs/severity",
          "description": "Severity override for thin-stroke findings."
        },
        "classes": {
          "type": "array",
          "minItems": 1,
          "uniqueItems": true,
          "items": {
            "type": "string",
            "enum": ["thin-stroke", "thin-fill", "thin-clipped-part", "thin-negative-space", "thin-annotation"]
          },
          "default": ["thin-stroke", "thin-fill"],
          "description": "Thin-parts object classes to inspect. Clipped parts, negative space, and annotation appearances are opt-in."
        },
        "severity_by_class": {
          "type": "object",
          "propertyNames": {
            "enum": ["thin-stroke", "thin-fill", "thin-clipped-part", "thin-negative-space", "thin-annotation"]
          },
          "additionalProperties": {
            "$ref": "#/$defs/severity"
          },
          "description": "Optional severity overrides keyed by thin-parts class."
        },
        "restrictions": { "$ref": "#/$defs/restrictions" }
      },
      "additionalProperties": true,
      "allOf": [
        {
          "if": {
            "properties": {
              "id": { "const": "ink-coverage" }
            },
            "required": ["id"]
          },
          "then": {
            "required": ["max_ink_pct"]
          }
        },
        {
          "if": {
            "properties": {
              "id": { "const": "thin-parts" }
            },
            "required": ["id"]
          },
          "then": {
            "required": ["min_effective_width_pt"]
          }
        }
      ]
    },
    "fixup": {
      "type": "object",
      "required": ["id"],
      "properties": {
        "id": {
          "type": "string",
          "minLength": 1,
          "pattern": "^[a-z][a-z0-9-]*$",
          "description": "Stable fixup identifier (kebab-case)."
        },
        "confirm": {
          "type": "boolean",
          "default": true,
          "description": "When true (default), UI must confirm before applying. Destructive fixups must set confirm: true."
        },
        "amount_pt": {
          "type": "number",
          "minimum": 0,
          "description": "Fixup length in points (e.g. add-bleed)."
        },
        "target_dpi": {
          "type": "integer",
          "minimum": 72,
          "maximum": 1200,
          "description": "Downsample target DPI; runtime profile validation also requires a registered fixup operation."
        },
        "params": {
          "type": "object",
          "additionalProperties": true,
          "description": "Optional parameters for automated fixup application (e.g. mode for add-bleed)."
        }
      },
      "additionalProperties": true
    }
  }
}
